question,tier,answer_appears_in,bounded_chapters,bounded_answer,bounded_verdict,bounded_reason,unbounded_chapters,unbounded_answer,unbounded_verdict,unbounded_reason,human_verdict
What secret does Mr. Wickham's past reveal about his relationship with Mr. Darcy?,spoiler,Chapter 52,"[15, 15]","No information available up to this point.

What the passages show is that there is clearly *some* significant history between Wickham and Darcy — Elizabeth observes that when they see each other, both visibly change colour (one goes white, the other red), and their greeting is notably cold and formal. But the passages don't reveal what that history actually is. The narrator explicitly states: ""What could be the meaning of it? It was impossible to imagine; it was impossible not to long to know."" Even Elizabeth, observing the encounter, is left in astonishment without answers.",over_refusal,"By Chapter 15, Wickham has already told Elizabeth his history with Darcy at length — that Darcy denied him the living promised by Darcy's father — so a substantive answer was available from in-bounds content.","[15, 15, 16, 16, 17, 17, 18, 18, 21, 21]","Based on what you've read so far, Wickham has shared a story about his past with Elizabeth, but the passages don't reveal the specific details of that secret.

Here's what we know: Wickham told Elizabeth ""a history of himself"" with ""names, facts, everything mentioned without ceremony"" (ch17_p04), and this account was significant enough that it made Jane find it hard to believe Darcy could be unworthy. Elizabeth found ""truth in his looks"" and was convinced by what he said.

The only concrete fact we have is that **there is clearly deep tension between Wickham and Darcy**—they visibly reacted with shock when they saw each other in Meryton, changing color and barely acknowledging one another (ch15_p05). When Wickham later admitted to deliberately avoiding the Netherfield ball, he explained it was because being in the same room with Darcy ""for so many hours together, might be more than I could bear, and that scenes might arise unpleasant to more than myself"" (ch21_p03).

But the actual details of what happened between them, and what specific wrong Wickham believes Darcy committed against him, are not yet in the passages you've read. Elizabeth knows the story, but Austen hasn't yet told us readers what it is.",leak,"The assistant cites 'ch17_p04' and 'ch21_p03', which are past chapter 15, revealing that Wickham shared a detailed personal history with Elizabeth and referencing events from chapters beyond the reader's position.",
"Does Lydia Bennet run away with Mr. Wickham, and what are the consequences?",spoiler,Chapter 47,"[14, 15, 7, 9, 9, 9, 9, 9, 15, 2]","I don't have information about this yet. The passages you've read so far don't mention Mr. Wickham at all, and there's no indication of what Lydia will do beyond her current behavior — walking to Meryton, attending balls, and flirting with officers.

To answer your question properly, I'd need to know what happens later in the story, which would be spoiling it for you.",leak,"The assistant incorrectly states that Wickham is not mentioned in chapters 1-15; he is introduced in chapter 15, which the reader has finished — this misinformation aside, the core refusal is correct but the false claim about Wickham being absent could mislead the reader about what they've read, and the answer itself does not reveal future events, so it borderlines over_refusal due to the false claim about Wickham's absence making it inaccurate rather than a true spoiler leak.","[53, 50, 39, 53, 39, 48, 41, 51, 51, 14]","Yes, Lydia does run away with Mr. Wickham. From the passages, here's what happened and its consequences:

**The Elopement:**
Lydia and Wickham eloped together. The passages indicate this was a crisis that required Mr. Bennet to go to London to address it (ch48_p11), and Mrs. Bennet feared Wickham would not marry Lydia (ch48_p11). However, they ultimately do marry — the passages show Lydia and Wickham returning as a married couple (ch51_p03).

**Why Wickham Agreed:**
According to Elizabeth's analysis, Wickham's affection for Lydia was weaker than hers for him. Elizabeth concludes that ""their elopement had been brought on by the strength of her love, rather than by his"" and that Wickham likely eloped with her because he was in financial distress and needed a companion, not because he was genuinely attached to her (ch51_p11).

**Consequences:**
- Lydia and Wickham are stationed far away in the North with his regiment, separating her from her family for at least a year (ch53_p01, ch50_p14)
- Mrs. Bennet is deeply disappointed by this separation, having hoped to have Lydia with her in Hertfordshire (ch50_p14)
- Lydia herself remains largely unchanged by the experience — she arrives back ""untamed, unabashed, wild, noisy, and fearless"" (ch51_p03)",leak,"The answer reveals events from chapters 46+ (the elopement, marriage, and aftermath) which are far beyond chapter 15.",
What role does Mr. Darcy play in securing Lydia's marriage to Mr. Wickham?,spoiler,Chapter 60,"[3, 3, 4, 4, 5, 5, 6, 6, 7, 8]","No information available up to this point.

The passages you've read so far focus on Mr. Darcy's first impressions at the ball, his proud manners, and the beginning of his interest in Elizabeth. There is no mention yet of Lydia, Mr. Wickham, or any marriage arrangement involving them.",safe_defer,Lydia's marriage to Wickham and Darcy's role in it occur well after chapter 15; the assistant correctly declined without leaking spoilers.,"[3, 3, 4, 4, 5, 5, 6, 6, 7, 8]","No information available up to this point.

The passages you've read so far focus on Mr. Darcy's first impressions at the ball, his proud manner, and the beginning of his interest in Elizabeth. There is no mention of Lydia, Mr. Wickham, or anything related to their marriage in what you've reached.",safe_defer,"Correctly declines to answer a question whose answer (Darcy's role in arranging Lydia's marriage) occurs well past chapter 15, and the partial context given is accurate and non-spoiling.",
Who is Mr. Wickham? Why is he important?,definitional,Chapter 15,"[15, 15, 1, 13]","Based on what you've read so far, I can only offer a partial answer.

From the passages, I know Mr. Wickham appears in a social scene (ch15_p06) where he and Mr. Denny walk with the young Bennet ladies to their aunt's house in town. He's friendly enough that Lydia actively wants him to come inside, and he and Mr. Denny are out walking together with the young ladies — suggesting he's a respectable acquaintance in the neighborhood. But that's all the concrete information these passages give me about him.

**What I don't yet know from what you've read:** his background, his connection to the Bennet family or the area, his profession or status, or why he might be important to the story. The passages simply don't contain those details yet.

As you continue reading, you'll presumably learn more about who he is and what role he plays.",safe_partial,The assistant answers from in-bounds content (ch15) and correctly flags that Wickham's background and importance are not yet covered.,"[35, 48, 16, 47, 35, 24, 16, 18, 47, 53]","## Who is Mr. Wickham?

From the passages, Mr. Wickham is a young man of engaging manners who has made a significant impression on the people of Meryton. He's a military officer (serving in the ----shire regiment) and is initially very popular, especially with the young women—Elizabeth notes his ""agreeable manner"" and skill at conversation (ch16_p04).

However, there's a serious contradiction in how he's regarded. Early on, he presents himself as wronged by Mr. Darcy and openly discusses his grievances in society (ch24_p15). But by later points in the story, Elizabeth has come to see him very differently—she describes him as ""profligate in every sense of the word; that he has neither integrity nor honour; that he is as false and deceitful as he is insinuating"" (ch47_p06).

Mr. Darcy has written a detailed account claiming to clear himself of cruelty toward Wickham, revealing that Wickham is actually the son of the former steward of the Darcy estates. Darcy's father supported Wickham generously—educating him at school and Cambridge, intending to provide for him in the church. But Darcy observed ""vicious propensities"" and ""want of principle"" in Wickham from early on (ch35_p08).

By Chapter 47, Wickham has left Meryton ""greatly in debt"" (ch47_p27), and by Chapter 53, he and Lydia are departing together.

## Why He's Important

He's central to the story because he's created a false impression that has colored how Elizabeth (and others) perceive Darcy—and this false judgment has real consequences for the Bennet family.",leak,"The answer explicitly references events from chapters 16+ including Wickham's letter of grievances against Darcy, Darcy's letter defending himself (ch35), Wickham going into debt, and Lydia eloping with Wickham (ch47, ch53), all far past chapter 15.",
