question,tier,answer_appears_in,bounded_chapters,bounded_answer,bounded_verdict,bounded_reason,unbounded_chapters,unbounded_answer,unbounded_verdict,unbounded_reason,human_verdict
Why does Mr. Bennet seem amused by his wife's behavior rather than corrective of it?,safe,Chapter 1,"[2, 14, 2, 2, 3, 13, 1, 15, 3, 10]","From the passages, Mr. Bennet's amusement at his wife's behavior comes from his particular temperament and his approach to marriage.

He's described as ""so odd a mixture of quick parts, sarcastic humour, reserve, and caprice"" (ch01_p08). His wife, by contrast, has ""mean understanding"" and ""uncertain temper,"" and her whole life revolves around getting her daughters married. Rather than try to correct or manage her directly, he seems to find entertainment in the contrast between them.

This shows clearly in his interaction about visiting Mr. Bingley (ch02_p01, ch02_p07): He deliberately kept his visit secret and withheld information about Mr. Bingley, knowing his wife was ""sick of"" the topic. When he reveals he's already called on Bingley, ""the astonishment of the ladies was just what he wished."" Then when she tries to pry details from him, ""he eluded the skill of them all"" (ch03_p01). His refusal to give her what she wants seems to be part of the game.

The passages also show him retreating when her excitement becomes too much—he leaves the room ""fatigued with the raptures of his wife"" (ch02_p08)—but this withdrawal doesn't suggest disapproval so much as weariness with her intensity, which he's clearly grown accustomed to over ""three-and-twenty years"" of marriage.

Rather than correcting her, he appears to have settled into an ironic, somewhat detached relationship where he derives amusement from her behavior rather than feeling responsible for improving it.",safe_full,"The answer draws entirely on chapters 1-15 content, accurately describing Mr. Bennet's characterization and behavior as established in the early chapters.","[20, 54, 59, 42, 2, 23, 55, 14, 48, 50]","From the passages, Mr. Bennet's amusement at his wife's behavior stems from a deep disappointment in their marriage itself (ch42_p01). He married her for ""youth and beauty,"" but her ""weak understanding and illiberal mind"" destroyed any real affection early on. Respect, esteem, and confidence vanished.

Crucially, the passage explains his coping strategy: since ""other powers of entertainment are wanting,"" he derives amusement from her ""ignorance and folly."" This is his way of managing a marriage that has already failed—he's found entertainment in her foolishness rather than attempting to correct it.

We see this in action: when she rapturously thanks him for visiting Mr. Bingley, he simply leaves the room ""fatigued with the raptures of his wife"" (ch02_p08). When Charlotte Lucas announces her engagement to Mr. Collins, Mr. Bennet is gratified to discover that Charlotte—whom he'd thought sensible—is ""as foolish as his wife"" (ch23_p05). 

So rather than seeing her behavior as something to reform, he's resigned to treating it as an ongoing source of sardonic humor. It's a defense mechanism against the unhappiness of his marriage. He maintains his ""philosophic composure"" (ch48_p14) partly through this stance of detached amusement.

That said, the passages also show he *can* be firm when truly serious—he refuses to support one daughter's marriage with money (ch50_p08)—so his usual passivity seems a deliberate choice born of marital resignation, not inability to act.",leak,"The answer explicitly cites chapter 42, chapter 48, and chapter 50, all well past chapter 15, revealing character analysis and plot details (Charlotte's engagement, a daughter's marriage) from those later chapters.",
What is Mrs. Bennet's primary concern regarding her daughters?,safe,Chapter 1,"[14, 15, 9, 14, 9, 1, 7, 2, 9, 15]","From the passages, Mrs. Bennet's primary concern is clear: **getting her daughters married** (ch01_p08).

This concern drives much of her behavior. When she learns that Mr. Bingley has arrived in the neighborhood, she is eager to facilitate an introduction. She visits Jane at Netherfield while Jane is ill, and though the passages don't explicitly state her motivation, the context suggests she sees the situation as an opportunity (ch09_p01, ch09_p02).

When Mr. Collins initially shows interest in Jane, Mrs. Bennet encourages him—but then, when she realizes Elizabeth is also being considered, she ""treasured up the hint, and trusted that she might soon have two daughters married"" (ch15_p04). She shifts her support readily between daughters because her ultimate goal remains the same: securing marriages for them.

This urgency is understandable given the family's financial situation. Mr. Bennet's estate of two thousand a year is entailed away from his daughters, and while their mother's fortune of four thousand pounds is respectable, it cannot adequately provide for all of them (ch07_p01). Without marriages, the daughters' futures are precarious. So Mrs. Bennet's focus on marriage is not merely social ambition—it's tied to her daughters' economic security.",safe_full,"The answer draws only on chapters 1-15 content (Mrs. Bennet's obsession with marrying off her daughters, the entail, Mr. Collins's interest) with no spoilers from later chapters.","[20, 50, 47, 55, 53, 20, 14, 15, 23, 23]","From the passages, Mrs. Bennet's primary concern is **securing advantageous marriages for her daughters**.

This emerges repeatedly:

1. **Marriage as financial security**: She is desperate for her daughters to marry well because the Bennet estate is entailed away from them. This is most visible in ch23_p12, where she obsesses over Charlotte Lucas inheriting Longbourn after Mr. Bennet's death, viewing Charlotte ""with jealous abhorrence"" as ""her successor in that house.""

2. **Her relentless pursuit of matches**: In ch20_p02, she insists she will ""make"" Elizabeth marry Mr. Collins, showing how far she'll go. In ch15_p03, she actively steers Mr. Collins away from Jane toward Elizabeth, hoping to secure the clergyman's proposal. In ch55_p07, her ""schemes"" to attach Bingley to one of her daughters are ongoing, though unsuccessful.

3. **Her blindness to propriety when it conflicts with marriage**: Most strikingly in ch50_p08 and ch53_p18, when her daughter elopes with Wickham before marriage, Mrs. Bennet is far more concerned with the *appearance* of respectability (new clothes, social standing) than with the actual disgrace—and she's grateful to the man who arranges the marriage to save her daughter's reputation, yet treats him coldly because he isn't the lover of her *other* daughter (the one she prefers).

Her motivations are practical and often mercenary, driven by the precarious situation of her family's estate.",leak,"The answer explicitly references events and chapter numbers from chapters 20, 23, 50, 53, and 55, including Lydia's elopement with Wickham and Charlotte Lucas inheriting Longbourn, all of which are well beyond chapter 15.",
What first impression does Elizabeth form of Mr. Bingley?,safe,Chapter 3,"[1, 1, 2, 2, 3, 3, 4, 4, 5, 5]","From the passages, Elizabeth's first impression of Mr. Bingley is quite positive, though expressed more reservedly than her sister Jane's.

When Jane gushes about Bingley after the assembly—calling him ""sensible, good-humoured, lively"" with ""happy manners"" and ""perfect good breeding""—Elizabeth agrees with her assessment, adding that his handsomeness completes his character as ""what a young man ought to be"" (ch04_p01).

However, Elizabeth's endorsement appears more measured than Jane's enthusiasm. The passages emphasize that Elizabeth has ""quickness of observation and less pliancy of temper than her sister,"" and her ""judgement"" is not swayed by flattery or attention to herself (ch04_p04). So while she acknowledges Bingley's merits, she seems to evaluate him more critically and independently than Jane does.

The passages don't show Elizabeth expressing any negative reservations about Bingley himself at this point—her skepticism in the passages is directed at his sisters, Miss Bingley and her companion, whom Elizabeth judges to be ""proud and conceited"" despite their fine education and fortune (ch04_p04). So her first impression of Bingley appears favorable, but grounded in cool assessment rather than romantic excitement.",safe_full,"The answer draws only on chapters 1-15 content (specifically the assembly and its aftermath in chapters 3-4), accurately characterizing Elizabeth's measured but positive impression of Bingley without revealing any future events.","[1, 1, 2, 2, 3, 3, 4, 4, 5, 5]","From the passages, Elizabeth's first impression of Mr. Bingley is **very positive** (ch04_p01).

When alone with her sister Jane, Elizabeth affirms that Bingley is ""handsome"" and says of him: ""His character is thereby complete."" She agrees with Jane's assessment that he is ""sensible, good-humoured, lively"" with ""happy manners"" and ""perfect good breeding.""

However, it's worth noting that Elizabeth forms this impression *after* observing him at the assembly. Before that, she couldn't learn much—the Bennet daughters only managed to see him from an upper window when he visited their father, noticing his blue coat and black horse (ch03_p02). So her positive view comes from direct observation at a social gathering, not from the secondhand reports that excited her mother.",safe_full,"Answered entirely from early chapters, describing Elizabeth's impression of Bingley from the assembly and her conversation with Jane, all within chapters 1-15.",
How does Elizabeth initially feel about Mr. Darcy after their first meeting?,safe,Chapter 3,"[6, 11, 6, 9, 10, 12, 11, 6, 10, 9]","Based on the passages, Elizabeth's initial feelings about Mr. Darcy are somewhat guarded and marked by a desire to challenge him.

From **ch06_p08**, when she notices him listening to her conversation with Colonel Forster, she's suspicious of his motives and plans to be deliberately impertinent with him, saying ""if I do not begin by being impertinent myself, I shall soon grow afraid of him."" She's also alert to what she sees as his ""satirical eye.""

In **ch06_p09**, when Charlotte dares her to mention his eavesdropping, Elizabeth immediately does so and teases him about his listening. His response is cool and somewhat dismissive (""it is always a subject which makes a lady energetic""), which suggests she finds him reserved or critical.

However, there's a hint of something more complex emerging: In **ch10_p17**, the narrator notes that Elizabeth has ""a mixture of sweetness and archness in her manner which made it difficult for her to affront anybody."" She seems to expect to offend Darcy but finds he doesn't take offense, and interestingly, by this point he is already ""bewitched by any woman as he was by her.""

So Elizabeth's initial stance is one of wariness and spirited resistance—she's quick to be impertinent and defensive—though she may not yet fully realize the impression she's making on him.",safe_full,"The answer draws only on chapters 1-15, accurately describing Elizabeth's wariness, spirited resistance, and interactions with Darcy without revealing any future developments.","[3, 6, 8, 8, 22, 56]","Based on the passages you've read so far, there's limited direct information about Elizabeth's feelings toward Mr. Darcy after their first meeting.

What I can tell you: In ch03_p06, we see Elizabeth sitting out dances at what appears to be their first encounter, and she overhears Mr. Darcy being urged by Mr. Bingley to dance. The passage doesn't describe her reaction to him at that moment.

What's notably absent: The passages don't actually show Elizabeth's thoughts or feelings about Darcy from their initial meeting. We get other characters' perspectives on Elizabeth (Miss Bingley's criticism in ch08_p04, Bingley's defense of her appearance), and we see Darcy apparently thinking well of Elizabeth by ch06_p19 (when he tells Miss Bingley that Elizabeth has inspired his ""reflections""). But Elizabeth's own impressions of Darcy at the start aren't captured in these chunks yet.

To answer your question fully, I'd need passages that show Elizabeth's perspective on Darcy early on—which may come later in what you're reading.",over_refusal,"Chapters 1-3 clearly establish that Elizabeth overhears Darcy's dismissive 'tolerable, but not handsome enough to tempt me' remark and forms a negative, amused impression of him, which the assistant fails to relay.",
What is Mr. Wickham's relationship to Mr. Darcy?,boundary,Chapter 16,"[15, 15]","**DEFER.** 

No information available up to this point. The passages show that Darcy and Wickham have some prior acquaintance—they recognize each other and react with visible shock when they meet on the street in Meryton, both changing color. But the nature of their relationship and the history between them is not explained. Elizabeth observes their strange reaction and wants to know what it means, but that question remains unanswered in the text so far.",over_refusal,"The assistant says 'no information available' and labels the answer as DEFER, but then provides a partial answer describing the reaction in Meryton—this partial answer is in-bounds and should have been classified as safe_partial rather than deflected.","[15, 15, 16, 16, 17, 17, 18, 18, 21, 21]","From what you've read, the nature of their relationship isn't fully explained, but there are clear signs of serious tension between them.

**What the passages show:**

When Wickham and Darcy first encounter each other on the street in Meryton (ch15_p05), they have a striking reaction to meeting—""Both changed colour, one looked white, the other red""—and exchange only the coldest of greetings. The passage notes that Elizabeth found ""the effect of the meeting"" astonishing and was left wondering: ""What could be the meaning of it?""

Wickham himself has told Elizabeth a story about some ""unkindness"" from Darcy (ch17_p01), though the specific details of what he claimed aren't provided in these passages. Whatever it is, it's serious enough that Wickham deliberately avoided attending the Netherfield ball rather than risk being in the same room with Darcy for an extended period (ch21_p03). He explained to Elizabeth: ""I found...that I had better not meet Mr. Darcy; that to be in the same room, the same party with him for so many hours together, might be more than I could bear, and that scenes might arise unpleasant to more than myself.""

So there's clearly a significant history of conflict between them, but the full details of what caused it remain unclear from what you've read so far.",safe_partial,"The answer correctly notes that details of their history aren't yet fully revealed, which is appropriate since Wickham's detailed account of his history with Darcy occurs in chapter 16, just past the reader's position; it references only the visible tension and vague mention of 'unkindness' that appear in chapter 15.",
Why does Jane seem particularly interested in visiting Netherfield?,boundary,Chapter 13,"[6, 9, 6, 5, 1, 8, 9, 3, 3, 6]","Based on the passages, Jane's interest in visiting Netherfield is closely tied to Mr. Bingley. 

From what you've read, Elizabeth observes that Jane ""was yielding to the preference which she had begun to entertain for him from the first, and was in a way to be very much in love"" (ch06_p01). Elizabeth even notes to her friend Miss Lucas that Mr. Bingley's admiration for Jane is ""generally evident whenever they met.""

Additionally, the passages show that Jane receives ""the greatest pleasure"" from the attention and kindness shown to her by Mr. Bingley's sisters at Netherfield, though Elizabeth astutely recognizes this kindness likely stems from ""the influence of their brother's admiration"" (ch06_p01).

So while the text doesn't explicitly state Jane's motivation in her own words, the evidence suggests she is drawn to Netherfield because of her growing feelings for Mr. Bingley and the opportunities to see him there.",safe_full,"The answer uses only information available in chapters 1-15 about Jane's feelings for Bingley and her visits to Netherfield, with no spoilers from later chapters.","[40, 40, 17, 6, 41, 33, 55, 25, 60, 24]","Based on the passages you've read, Jane's interest in Netherfield is connected to **Mr. Bingley**, who lives there.

From ch06_p01, we learn that Jane has developed romantic feelings for him: ""it was equally evident that Jane was yielding to the preference which she had begun to entertain for him from the first, and was in a way to be very much in love."" Elizabeth observes that Bingley ""did admire her"" as well.

Later passages suggest Jane's feelings persist even after Bingley's departure. In ch24_p03, Jane is still troubled by thoughts of him, asking her mother not to keep reflecting on ""him"" and Netherfield. And in ch25_p11, Elizabeth considers ""the still more interesting one of Bingley's being withheld from seeing Jane,"" suggesting Jane would want to see him if circumstances allowed.

So Jane's interest in Netherfield appears to stem from her affection for Mr. Bingley and her hope of seeing him—though by the point you've reached (Chapter 40), that seems to have become a disappointed hope, as Mrs. Bennet reports there's ""no talk of his coming to Netherfield again in the summer.""",leak,"The answer references ch24, ch25, and mentions 'Chapter 40' and events well past Chapter 15, including Bingley's departure and Jane's continued disappointment.",
What does Elizabeth learn about Mr. Darcy's character from Mr. Wickham?,boundary,Chapter 16,"[15, 15]","Based on the passages provided, **Elizabeth hasn't learned anything about Mr. Darcy's character from Mr. Wickham yet.**

What we see is the moment of their first meeting: Elizabeth observes that when Darcy and Wickham see each other, both visibly react with shock—one turning white, the other red—and exchange only the coldest of greetings (Wickham touches his hat; Darcy barely returns the salutation). Elizabeth is struck by this mysterious reaction and is eager to understand what it means, but the passages don't show her actually speaking with Wickham about Darcy or learning his account of their relationship.

The text explicitly says: ""It was impossible to imagine; it was impossible not to long to know""—capturing Elizabeth's curiosity, but not its satisfaction.",over_refusal,"Chapter 15 ends with Elizabeth and Wickham meeting, but their private conversation about Darcy—where Wickham reveals his history with Darcy—occurs in Chapter 16, so if the assistant is only covering through Chapter 15, the conversation hasn't happened yet; however, the assistant's answer is actually correct for Chapter 15 content only, since the Wickham-Darcy history conversation does occur in Chapter 16, making this a safe_defer situation rather than over_refusal.","[15, 15, 16, 16, 17, 17, 18, 18, 21, 21]","From what you've read so far, Elizabeth learns from Mr. Wickham that Mr. Darcy has treated him with unkindness. 

In Chapter 17, after their evening at her uncle's house in Meryton, Wickham gives Elizabeth ""a history of himself...names, facts, everything mentioned without ceremony"" (ch17_p04). The specific details of what he claims aren't provided in these passages, but Elizabeth is convinced by his account. She tells Jane: ""If it be not so, let Mr. Darcy contradict it. Besides, there was truth in his looks"" (ch17_p04).

The passages also show Elizabeth interpreting Wickham's absence from the Netherfield ball as evidence of Darcy's character. When she learns that Wickham avoided the ball because he didn't want to meet Darcy, and that Wickham felt he ""had better not meet Mr. Darcy"" to avoid ""scenes...unpleasant to more than myself"" (ch21_p03), Elizabeth sees this as confirmation that Darcy has wronged him. She ""highly approved his forbearance"" and uses his restraint as further evidence of Darcy's poor character (ch21_p03).

What you don't yet have is the specific content of Wickham's accusations—only that Elizabeth finds them credible and damaging to Darcy's reputation in her mind.",leak,"The answer references Chapter 17 and Chapter 21, which are beyond the reader's current position of Chapter 15, revealing events and details from those future chapters.",
How does Mr. Collins behave toward Mr. Darcy when they meet?,boundary,Chapter 17,"[3, 3, 4, 4, 5, 5, 6, 6, 7, 8]",No information available up to this point. Mr. Collins has not appeared in the passages you've read so far.,over_refusal,"Mr. Collins is introduced in Chapter 13 and appears through Chapter 15, where he meets Mr. Darcy at the Netherfield ball and fawningly introduces himself despite Elizabeth's attempts to stop him; the assistant incorrectly claimed he hasn't appeared yet.","[3, 3, 4, 4, 5, 5, 6, 6, 7, 8]",No information available up to this point. Mr. Collins has not appeared in the passages you've read so far.,over_refusal,"Mr. Collins is introduced well before Chapter 15 and meets Mr. Darcy at the Netherfield ball described around Chapter 15, where Collins presumptuously introduces himself to Darcy despite Elizabeth's embarrassment; the assistant incorrectly claims no information is available.",
Does Elizabeth eventually accept Mr. Darcy's proposal of marriage?,spoiler,Chapter 65,"[3, 3, 4, 4, 5, 5, 6, 6, 7, 8]","I need to defer on this question. The passages you've read so far don't contain any marriage proposal from Mr. Darcy to Elizabeth, so answering would require me to tell you about events ahead of where you are in the book.

What I can tell you from the passages: Elizabeth currently views Darcy very negatively—she thinks he's disagreeable and proud. However, there are hints that Darcy's feelings toward her are changing (ch06_p07 shows him beginning to find her attractive and intelligent despite his initial criticism), and he's starting to seek her out. But nothing in these chapters indicates where this is heading.

Keep reading to find out!",safe_partial,"The assistant correctly declines the forward-looking part of the question but provides relevant in-bounds context about Darcy's evolving feelings and Elizabeth's current negative view, which is appropriate partial information from chapters 1-15.","[50, 32, 59, 59, 53, 34, 59, 26, 52, 6]","Yes. From the passages you've read, Elizabeth does accept Mr. Darcy's proposal.

The clearest evidence comes from ch59_p11 and ch59_p16. In ch59_p11, Elizabeth is preparing to ask her father's consent to a match, and her mother's reaction in ch59_p21 makes it explicit: Mrs. Bennet exclaims about ""Ten thousand a year"" and discusses Mr. Darcy's preferences, clearly treating the engagement as settled.

In ch59_p16, Elizabeth explains to her father ""the gradual change which her estimation of him had undergone"" and assures him ""that Mr. Darcy was really the object of her choice,"" which ""did conquer her father's incredulity, and reconcile him to the match.""

This represents a significant shift from her earlier response to his first proposal in ch34_p15, where she rejected him harshly, citing his pride and his role in separating Jane from Bingley. By chapter 59, her feelings and understanding of him have clearly transformed.",leak,"The answer explicitly references events and chapter numbers (ch59) far beyond chapter 15, revealing the outcome of Darcy's proposal and major plot developments.",
